{"clusterId":"short_continuation-es","consequential":false,"episodeId":"short_continuation-es","expectedArtifacts":[],"expectedReceipts":[],"family":"short_continuation","history":null,"initialState":{"fixtureId":"empty","org":"fixture-org","persona":"owner","sandbox":false,"sha256":"99a99a5c1b4b648f103750b2f39f2e456328192550054332b6d13730c59ac29e","surface":"home"},"leakageGroupId":"short_continuation-es","locale":"es","maxEffort":{"calls":4,"durationMs":15000,"steps":10},"permissions":{"allowedActions":[],"allowedTools":[],"forbiddenActions":["production_write"],"forbiddenTools":["send_email"]},"provenance":"synthetic_software","steps":[{"payload":{"text":"Responde fixture answer short_continuation-es"},"type":"turn"},{"payload":{"text":"Continúa."},"type":"turn"}],"terminal":{"criterion":"answer_contains","expectedText":"fixture answer","forbiddenSideEffects":["production_write"]},"truth":{"references":["synthetic:answer"],"sha256":"b7ee2726de6ca82314c48a0190296560be0f3954487beb645468cdb16c09e23a"},"version":1}
