{"clusterId":"multi_intent_navigation-en","consequential":false,"episodeId":"multi_intent_navigation-en","expectedArtifacts":[],"expectedReceipts":[],"family":"multi_intent_navigation","history":null,"initialState":{"fixtureId":"empty","org":"fixture-org","persona":"owner","sandbox":false,"sha256":"99a99a5c1b4b648f103750b2f39f2e456328192550054332b6d13730c59ac29e","surface":"home"},"leakageGroupId":"multi_intent_navigation-en","locale":"en","maxEffort":{"calls":4,"durationMs":15000,"steps":10},"permissions":{"allowedActions":[],"allowedTools":[],"forbiddenActions":["production_write"],"forbiddenTools":["send_email"]},"provenance":"synthetic_software","steps":[{"payload":{"text":"Answer fixture answer multi_intent_navigation-en"},"type":"turn"}],"terminal":{"criterion":"answer_contains","expectedText":"fixture answer","forbiddenSideEffects":["production_write"]},"truth":{"references":["synthetic:answer"],"sha256":"b7ee2726de6ca82314c48a0190296560be0f3954487beb645468cdb16c09e23a"},"version":1}
