{"clusterId":"ui_choice-es","consequential":false,"episodeId":"ui_choice-es","expectedArtifacts":[],"expectedReceipts":[],"family":"ui_choice","history":null,"initialState":{"fixtureId":"empty","org":"fixture-org","persona":"owner","sandbox":false,"sha256":"c8d106dd38be7d2708122440259d57f8df94eec4cffa0333fd4d035300d5d9f9","surface":"home"},"leakageGroupId":"ui_choice-es","locale":"es","maxEffort":{"calls":4,"durationMs":15000,"steps":10},"permissions":{"allowedActions":[],"allowedTools":["ui.choice"],"forbiddenActions":["production_write"],"forbiddenTools":["send_email"]},"provenance":"synthetic_software","providerFixture":{"main":[{"text":"```minion-ui\n[{\"tool\":\"ui.choice\",\"input\":{\"question\":\"Pick a fixture option\",\"options\":[{\"label\":\"Choose fixture\"}]}}]\n```"},{"text":"Fixture choice completed."}]},"steps":[{"payload":{"text":"Pide mi elección con un botón."},"type":"turn"},{"payload":{"action":"choice","index":0},"type":"transition"}],"terminal":{"criterion":"answer_contains","expectedText":"Fixture choice completed.","forbiddenSideEffects":["production_write"]},"truth":{"references":["synthetic:answer"],"sha256":"b7ee2726de6ca82314c48a0190296560be0f3954487beb645468cdb16c09e23a"},"version":1}
